Date,Coin,website,Headline,Text,Link
2018-01-02 03:45:00,Ripple,cointelegraph,South Korea More Than Doubled Ripple’s Price in Single Week,"Receive all Cointelegraph news immediately in Telegram. Cointelegraph   Advertise   The South Korean cryptocurrency market has played a crucial role in bringing RIpple from a market cap of $40 billion to $88 billion. Analysis The South Korean cryptocurrency market accounts for a relatively small percentage of global Bitcoin trades, but has nonetheless played a crucial role in bringing RIpple’s market capitalization from $40 billion to $88 billion. Ripple was one of the best-performing crypto assets of 2017, boasting a 360x increase in value. Exactly one year ago, on January 1, 2017, a single Ripple sold just six-tenths of a cent. Today, a single token is worth $2.29. Over the past week, Ripple overtook Ethereum to become the second largest cryptocurrency in the global market, becoming the first “altcoin” to reach a $100 billion market valuation. Many investors, especially Ethereum and Bitcoin holders, were taken aback by Ripple’s sudden surge. Analysts have attributed the recent increase in the value of Ripple to the formation of strategic partnerships between SBI Ripple Asia and South Korean banks, according to Forbes. However, the newly partnered banks will only begin processing payments on the Ripple network by the end of the first quarter of 2018. This has led some to question whether these partnerships are the real reason for Ripple’s incredible surge. One such skeptic is Ryan Selkis, entrepreneur-in-residence at Ethereum-focused Blockchain production studio ConsenSys said in an interview: ""I know of no banks that are a) using it, or b) would touch it in any way as it is controlled by a SV company and 20% of all XRP in existence were taken by the founders. The product that Ripple are offering to banks is simply a point-to-point messaging tool with some smart cryptography underneath to ensure that transactions are atomic. The liquidity model used is the same as correspondent banking. Some banks will have deep pools of liquidity available to terminate payments. Ripple's approach with XRP has been to get it listed on a bunch of exchanges and ‘infer' but never explicitly say that banks are using it for settlement.” The claim that no banks are using the Ripple network to process payments is not entirely accurate. Earlier this year, major Swedish bank SEB settled $180 million on the Ripple Blockchain network by sending cross-border payments on behalf of high profile clients. Banks in Thailand and Japan have also been processing near-instantaneous transactions for many months using Ripple. However, it is true that no major banks are utilizing the Ripple Blockchain network on a daily basis to process large volumes of transactions. Tony Lyu, the founder and CEO of South Korean cryptocurrency exchange Korbit, told the New York Times that the South Korean market is heavily driven by FOMO, or fear of missing out. Lyu said: “Word just spreads really fast in Korea. Once people are invested, they want everyone else to join the party. There’s been this huge, almost a community movement around this.” Over the past week, the South Korean market and its largest cryptocurrency exchanges including Bithumb, Coinone, and Korbit have accounted for more than half of Ripple’s $4.5 bln daily trading volume. South Koreans continue to pay a premium for their digital currency. On Bithumb, for instance, Ripple is being traded at $2.54, nearly 24 percent higher than the global average price.  Caption: Price of Ripple and other cryptocurrencies on Bithumb Speculation and cryptocurrency mania in the South Korean market have become a major concern for the government policy makers. South Korean financial authorities have prohibited foreigners and underaged investors from investing in cryptocurrencies in an effort to bring the speculation under control.  Follow us on Facebook  Follow us on Facebook Hide Comments  For updates and exclusive offers, enter your e-mail below.  Cointelegraph covers Fintech, Blockchain and Bitcoin bringing you the latest news and analyses on the future of money.   Thank you for contacting us! We will reply to you as soon as possible. Thank you for your interest in our franchise program. We are considering your request and will contact you in due course. If you have any further queries, please contact: franchise@cointelegraph.com",https://cointelegraph.com/news/south-korea-more-than-doubled-ripples-price-in-single-week
2018-01-02 19:00:00,Ripple,cointelegraph,"Bitcoin, Ethereum, Bitcoin Cash, Ripple, IOTA, Litecoin, Dash, Cardano: Price Analysis, Jan.2","Receive all Cointelegraph news immediately in Telegram. Cointelegraph   Advertise   Bullish market? Let’s see. Price Analysis The views and opinions expressed here are solely those of authors/contributors and do not necessarily reflect the views of Cointelegraph.com. Every investment and trading move involves risk, you should conduct your own research when making a decision. The cryptocurrency mania can be gauged from the fact that Bitcoin, with its 1300 percent plus gains, doesn’t find a place among the top 10 best performing cryptocurrencies of 2017. The top performer was Ripple, with more than astounding 30,000 percent increase over a year. In comparison, the traditional investors consider themselves lucky if they outperform the S&P 500, which rallied 20 percent last year. While no one can predict what will happen in 2018, one thing is certain; if the traders can spot the setups, they can reap a rich reward. As we already saw both cryptocurrencies rallying collectively and them going separate ways, it might be a good idea to diversify your portfolio with more than one cryptocurrency. Our attempt should be to trade the best setups that can offer us the maximum profits with the minimum risk. So, let’s find out the probable candidates to buy this week. Bitcoin is finding strong buying support at the 50-day SMA; but, unlike before, it is not able to pullback with strength. The bears are strongly defending the $14,000 levels. The daily range has been shrinking for the past two days.  On Dec. 30, though the BTC/USD pair broke below the neckline of the bearish head and shoulders pattern, it could not break below the 50-day SMA. It quickly climbed back above the neckline on the next day. The bulls are finding it difficult to break out of the overhead resistance from the down trendline and the 20-day EMA; and we don’t find any buy setup between $12,000 and $14,000. Still, Bitcoin is likely to rally to $16,000, once the cryptocurrency breaks out of the down trendline. On the other hand, if it breaks down of $12,000, it can retest the lows made on Dec. 22. We expect a large range move within the next couple of days. We had mentioned that the digital currency will gain strength once it breaks out and closes above the downtrend line and that is what happened.  The ETH/USD pair broke out of the downtrend line on December 31 and crossed the overhead resistance of $760 on January 01. Thereafter, it picked up momentum and has created a new lifetime high today. If the bulls manage to sustain above $863, we can expect a rally to $973 levels, which is the next Fibonacci extension target. The resistance line of the ascending channel is also at this level. Therefore, we expect this level to offer a strong resistance. On the downside, if the bulls fail to sustain above $863, the trendline of the channel close to the $760 mark, will act as a strong support. We expected Bitcoin Cash to plunge to the 50-day SMA, once it broke below the $2,300 mark. Instead, it took support at the trendline and is attempting a recovery.     If the BCH/USD pair sustains above $2,475, it should attempt a rally to $2,900 levels, which is a major resistance. Any fall is likely to be supported at the trendline and if it breaks, the next support is at $2,072. However, the risk to reward ratio is not attractive, hence, we don’t recommend any trade on it right now.     The correction in Ripple was short lived as the buyers jumped in at the $1.61 mark; it shows strength.  For the past two days, the XRP/USD pair had been facing resistance at the $2.1 mark. Today, the bulls broke out of the resistance, which can push the pair to $2.474 levels. We already saw the cryptocurrency consolidating for six to seven days, before resuming its uptrend. Thus, we anticipate a few more days of consolidation before the price breaks out to new lifetime highs. On the downside, $1.8 and $1.6 are the two critical support levels. The momentum loses strength only when it breaks down to $1.6.   We had indicated in our previous analysis that long positions can be initiated on a breakout and close above the downtrend line.  As the bears were unable to sustain below the critical support level of $3.032 for the past few days, chances are that the bulls will attempt to push the price towards the upper end of the range at $5.59. Therefore, traders who haven’t initiated a long position yet can still do at the current levels of $4.121, with a stop loss of $2.85. We are aiming to trade the large range by buying close to the support and selling at the resistance. We await  IOTA/USD pair to be volatile but with a positive bias.    The bears had the upper hand on Dec. 30, with a break of the neckline of the head and shoulders pattern. But the bulls supported Litecoin around the $200 mark.  Currently, the LTC/USD pair has broken out of the downtrend line, the neckline and the 20-day EMA. This is a positive move. Above $250, a move to $283 and thereafter to $300 is likely. On the downside, strong support exists at $200 and below this at $175, from the 50-day SMA. As this is still a pullback, we don’t suggest a trade on it. We expected the trendline support to hold and that is what happened. The cryptocurrency fell to the trendline on Dec. 30. However, the bounce from the support has been impressive.    We believe that the DASH/USD pair can now rally to $1,220 levels, where it is likely to face some resistance. On the other hand, any fall will find support at the trendline. Since the risk to reward ratio does not look good, we are not suggesting any trade. Cardano remained in a range from Oct. 01 to Nov. 25. Thereafter, it rallied for four days and again became range-bound until Dec. 14. It then spiked again in the next five days from $0.135375 to $0.581983. Subsequently, it entered into a correction, which ended around the $0.37 levels.    The latest leg of the up move started on Dec. 28 and it has crossed its first target objective of $0.75. The previous rallies lasted for around four to five days. Hence, we anticipate a pullback around the current levels, which should be a good buying opportunity, as the cryptocurrency remains in a strong uptrend. Any pullback should find strong support at $0.68 and $0.60 levels. The market data is provided by TradingView.  Follow us on Facebook  Follow us on Facebook Hide Comments  For updates and exclusive offers, enter your e-mail below.  Cointelegraph covers Fintech, Blockchain and Bitcoin bringing you the latest news and analyses on the future of money.   Thank you for contacting us! We will reply to you as soon as possible. Thank you for your interest in our franchise program. We are considering your request and will contact you in due course. If you have any further queries, please contact: franchise@cointelegraph.com",https://cointelegraph.com/news/bitcoin-ethereum-bitcoin-cash-ripple-iota-litecoin-dash-cardano-price-analysis-jan2
2018-01-04 01:10:00,Ripple,cointelegraph,"Ripple Pushes Past $3, Reaches Almost Half Bitcoin’s Market Cap","Receive all Cointelegraph news immediately in Telegram. Cointelegraph   Advertise   Ripple crosses $3, growing over 130% in one week, while Bitcoin dominance hits new record low. when moon Ripple (XRP), currently the second largest cryptocurrency by market capitalization, has continued its recent rally, crossing the $3 per coin mark. At press time, the altcoin was trading at an average of $3.12. Ripple’s price has increased almost 49,000 percent over the past twelve months. The cryptocurrency passed $2 just last week, seeing a 130% increase since Dec 27. This has cemented Ripple’s number two position with a market cap of $121 bln, almost half that of Bitcoin.  Ripple markets itself as a Blockchain-based payment solution for enterprise level global payment transactions. The addition of the coin on Bloomberg's price terminal in mid-December arguably started the substantial rally. A recent “cryptocurrency mania” on South Korean market, during which almost half of Ripple trading volumes occurred several multiple exchanges in the country, has also contributed to the altcoin’s rise. Investors and cryptocurrency believers have been pursuing other altcoins recently as well, creating substantial gains in the top 30. The most notable gains include Cardano (ADA) and Stellar (XLM), which have both jumped more than 30% on the day, as well as Status (SNT), which saw an over 100 percent increase in the past 24 hours. Meanwhile, on Jan. 3 BTC dominance (percentage of total market capitalization) hit a new record low of 34.6 percent.  Follow us on Facebook  Follow us on Facebook Hide Comments  For updates and exclusive offers, enter your e-mail below.  Cointelegraph covers Fintech, Blockchain and Bitcoin bringing you the latest news and analyses on the future of money.   Thank you for contacting us! We will reply to you as soon as possible. Thank you for your interest in our franchise program. We are considering your request and will contact you in due course. If you have any further queries, please contact: franchise@cointelegraph.com",https://cointelegraph.com/news/ripple-pushes-past-3-reaches-almost-half-bitcoins-market-cap
2018-01-04 18:45:00,Ripple,cointelegraph,"Bitcoin, Ethereum, Bitcoin Cash, Ripple, IOTA, Litecoin, NEM, Cardano: Price Analysis, Jan. 04","Receive all Cointelegraph news immediately in Telegram. Cointelegraph   Advertise   With Bitcoin losing its market value to altcoins, let’s see what orders to place. Price Analysis The views and opinions expressed here are solely those of authors/contributors and do not necessarily reflect the views of Cointelegraph.com. Every investment and trading move involves risk, you should conduct your own research when making a decision. While China banned initial coin offering (ICO) back in September 2017, it has not prevented the Chinese social network Renren from seeking an ICO. The company’s stock, which is listed on the New York Stock Exchange climbed 47.39 percent to $18.32 a share following the news. Similarly, Israeli trading company Plus500 saw its stock price spike 20 percent as it reported that cryptocurrency trading had boosted its profits. This shows that the markets are excited about the companies getting involved with the Blockchain technology or cryptocurrencies. But not regulators, apparently. The Israel Securities Authority, for example, is not in favor of stocks, whose main business is linked to cryptocurrencies. The regulator plans to prohibit the listing of shares of such companies. Will other stock markets regulators also follow? Difficult to say. As the cryptocurrencies market cap has crossed over the $760 bln point with altcoins outperforming Bitcoin, let’s see if we can identify any buy or sell patterns today. Though Bitcoin broke out of the downtrend line, it did not reach our expected target objective of $16,000. Failure of the bulls to capitalize on the breakout of the downtrend line is a bearish sign.  We find a symmetrical triangle developing, which is a continuation pattern. The cryptocurrency is currently retesting the breakout levels of the triangle. If it holds the $14,000 levels and reverses direction, we suggest long positions above $15,500. If the BTC/USD pair falls below $14,000, it is likely to fall to the neckline and below that to the trendline of the triangle. A breakdown of $12,000 levels will be negative, which can extend the fall to $8,000 levels. Therefore, traders should keep a stop loss around $13,500 once their long positions are triggered. Also, avoid buying below the specified levels. We expected a move to $973, once Ethereum sustained above $863 and it has reached our target objective today.    The resistance line of the channel is likely to act as strong resistance. Based on the previous experience, we find that once the cryptocurrencies are in a momentum, they overshoot their target objectives. Therefore, traders can book partial profits at the resistance line and hold the rest with a close stop-loss because if the ETH/USD pair breaks out of the ascending channel, it can rally to $1,200 levels. However, the markets can turn down in a jiffy, so make sure to trail the stops higher instead of being fixated on the targets. Though Bitcoin Cash broke out of $2,475, it could not reach $2,900 levels, as we had expected. It turned back from $2,770.6933.      The cryptocurrency has again fallen to the critical trendline support, which has provided support on two previous occasions. If this level breaks, there is marginal support at the $2,072.6853 point; below that a fall to $1,733.3558 is likely. If the trendline support holds, we may see another attempt by the bulls to push the  BCH/USD pair higher. The pair is likely to gain momentum above $2,800 levels.     Ripple did not waste any time in consolidation, as we had anticipated. It just broke out to new lifetime highs yesterday and has continued higher.  With this rally, the pair has risen from a low of $0.22255 on December 11 to a high of $3.317 today. That is a 1,390 percent rally within a month. It is difficult to project a target when an asset class is backed by such a strong momentum. However, as a reference, the next target on the XRP/USD pair is $3.414 and above it $3.90469. Nevertheless, even at the risk of missing out on a further rally, we believe that the traders should book about 50% profits at the current levels and hold the rest with a close stop loss. The cryptocurrency is clearly overbought and is due for a correction or a consolidation shortly.    We have recommended long positions on IOTA in our two previous analyses. We expect the bulls to attempt a rally towards the upper end of the range at $5.59.  The bears are defending the overhead resistance of $4.34. Currently, the IOTA/USD pair is taking support at the 20-day EMA. If this level breaks, it is likely to retest the lows at $3.03 levels. The cryptocurrency pair will gain momentum only above $4.34 levels. Since IOTA is still inside the range, we recommend holding to the long position with a stop loss of $2.85. We shall reconsider our position in a couple of days.    The pullback in Litecoin could not sustain above the $250 levels. The cryptocurrency has again broken below the neckline of the bearish head and shoulders pattern.  It has again broken below the 20-day EMA, which has flattened out. Still, we find buying on dips, closer to the $200 levels. The LTC/USD pair has support at $195.417, below that at $179.7308 from the 50-day SMA, and finally at $175.199, which is the lows formed on December 22. If the cryptocurrency pair doesn’t break out of $260 within a couple of days, we expect it to resume its slide towards the lower targets. NEM has climbed from a low of $0.23595 on December 08 to a high of $2.06278 today, which is a 774 percent rally within a month. It has climbed to the sixth position in terms of market capitalization. Hence, we included it in our analysis.    The XEM/USD pair has risen vertically over the past three days. It has a target objective of $2.13774, which is a critical Fibonacci extension level. We expect some resistance at this overhead resistance. Therefore, traders should keep a close stop-loss on their position. It does not necessarily mean that the cryptocurrency will crash from $2.13774 levels. It can consolidate for a few days and then again resume its uptrend. In a correction, we expect support at $1.57849 and $1.42889, which are 38.2 percent and 50 percent Fibonacci retracement levels of the recent leg of the up move from $0.794 to $2.06278.   As we don’t have the charts with enough data available for ADA/USD, we are analyzing the ADA/BTC pair. We expected Cardano to correct in our previous analysis; however, it extended its rally in the past two days and proved us wrong.  From a low of 0.00000338 on Nov. 25 to a high of 0.00009180, today, the ADA/BTC pair has risen 2,615 percent in one and half months. This shows that it is in a strong momentum. Though momentum can carry it higher, the rally is overextended and is likely to enter into a consolidation or correction soon. Therefore, traders should book partial profits on every rise and should keep a close stop loss on their remaining position. It is difficult to call a top, but the risk to reward is skewed to the downside. The market data is provided by TradingView.  Follow us on Facebook  Follow us on Facebook Hide Comments  For updates and exclusive offers, enter your e-mail below.  Cointelegraph covers Fintech, Blockchain and Bitcoin bringing you the latest news and analyses on the future of money.   Thank you for contacting us! We will reply to you as soon as possible. Thank you for your interest in our franchise program. We are considering your request and will contact you in due course. If you have any further queries, please contact: franchise@cointelegraph.com",https://cointelegraph.com/news/bitcoin-ethereum-bitcoin-cash-ripple-iota-litecoin-nem-cardano-price-analysis-jan-04
2018-01-05 03:10:00,Ripple,cointelegraph,"Coinbase Rejects Ripple Integration Rumors, Currency’s Market Cap Drops $22 Billion","Receive all Cointelegraph news immediately in Telegram. Cointelegraph   Advertise   Coinbase has refuted recent rumors that Ripple (XRP) will be integrated into GDAX, its flagship digital currency exchange. Analysis The popular exchange and wallet platform Coinbase has refuted recent rumors that Ripple (XRP) or other cryptocurrencies will soon be integrated into GDAX, its flagship digital currency exchange. CEO Brian Armstrong firmly stated that neither Coinbase and GDAX have made a decision to integrate any cryptocurrency or digital asset in the short-term. The company said in a blog post: “A committee of internal experts is responsible for determining whether and when new assets will be added to the platform in accordance with our framework. These individuals — and all employees at Coinbase — are subject to confidentiality and trading restrictions. As of the date of this statement, we have made no decision to add additional assets to either GDAX or Coinbase. Any statement to the contrary is untrue and not authorized by the company.” Coinbase’s statement was released following a spate of unverified rumors that claimed GDAX is planning to integrate XRP. The scale of the rumors, which largely circulated on Reddit and Twitter, increased to the point where the company felt the need to refute them, as the price of XRP surged. Immediately after Coinbase issued its statement, the market valuation of XRP decreased from over $148 billion to $126 billion.  Coinbase and GDAX are unlikely to integrate any new assets until they can be certain to prevent any leaks. In early December, when Coinbase added Bitcoin Cash, a Coinbase employee or a contractor reportedly revealed the integration two days prior to the official announcement. Coinbase received significant backlash and criticism from the cryptocurrency community and as a consequence, Armstrong vowed to launch a full investigation. The CEO stated that Coinbase will pursue legal action against the employee or contractor that released confidential information on the company’s digital asset integration plans. As such, the recent statement of Armstrong and rumors around Coinbase’s Ripple integration were also criticized by some of the community’s most prominent experts. These include BitGo lead engineer Jameson Lopp, who tweeted: We haven't made any decisions to add new assets to Coinbase or GDAX at this time. Any statement to the contrary is untrue. Be careful what you believe out there! https://t.co/1yUYG33AoG The investigation into the Bitcoin Cash controversy is still ongoing and until that is completed, it is highly unlikely that Coinbase will pursue the implementation of other cryptocurrencies. The company’s CEO admitted that some insider trading-like movement was spotted in the global Bitcoin Cash exchange market prior to the listing of Coinbase. On December 20, Armstrong wrote: “Given the price increase in the hours leading up the announcement, we will be conducting an investigation into this matter. If we find evidence of any employee or contractor violating our policies — directly or indirectly — I will not hesitate to terminate the employee immediately and take appropriate legal action.” Former Coinbase executive Charlie Lee also stated: “Coinbase is not adding a new coin anytime soon. There's no reason why they would lie about this... Especially after the flack they got for surprising everyone by adding BCH.”  Follow us on Facebook  Follow us on Facebook Hide Comments  For updates and exclusive offers, enter your e-mail below.  Cointelegraph covers Fintech, Blockchain and Bitcoin bringing you the latest news and analyses on the future of money.   Thank you for contacting us! We will reply to you as soon as possible. Thank you for your interest in our franchise program. We are considering your request and will contact you in due course. If you have any further queries, please contact: franchise@cointelegraph.com",https://cointelegraph.com/news/coinbase-rejects-ripple-integration-rumors-currencys-market-cap-drops-22-billion
