Date,Coin,website,Headline,Text,Link
2017-12-09 20:18:00,Ripple,cointelegraph,"Price Analysis, December 09: Bitcoin, Ethereum, Bitcoin Cash, Ripple, Litecoin, Dash","Receive all Cointelegraph news immediately in Telegram. Cointelegraph   Advertise   You don’t want to miss out this price analytics. Price Analysis The views and opinions expressed here are solely those of authors/contributors and do not necessarily reflect the views of Cointelegraph.com. Every investment and trading move is risky, you should conduct your own research when making a decision. Bitcoin is on the cusp of mass adoption, with futures trading starting on the CBOE from 6 p.m. ET on Sunday and on the CME from December 18. After the buying frenzy of the past few days, the question in everybody's mind is whether the trading in futures will boost prices higher or will the short sellers use the opportunity to sink prices lower. This is an unprecedented event; hence, it is very difficult to forecast the final outcome. Nevertheless, the volatility is likely to remain high in the first few hours and days of futures trading, as both the bulls and the bears slug it out at the CBOE. While the intraday traders can use the opportunity to profit from the volatility, it will be a difficult time for the investors. Additionally, how will the trading in Bitcoin affect the altcoins? Will it be bullish or will bitcoin garner all the attention? We will get the answers next week. Until I get a clear picture, I will not recommend any trading positions at the moment. The momentum in Bitcoin pierced through the critical Fibonacci resistance levels. It hit a high of $17237.44, well above the levels where I had advocated booking profits in my previous analysis.     After three large range days, the digital currency is forming an inside day candlestick pattern. I believe that the first few hours of futures trading are likely to be very volatile. It is difficult to predict, which way will the prices move. We can only keep certain levels in mind and work with them once the volatility subsides. On the downside, support is at $12734.97 and $11344.15, which are 38.2% and 50% Fibonacci retracement levels of the rally from $5450.86 to $17237.44. On the upside, if price breaks out to new highs, its next level of resistance is the Fibonacci extension level of $18281.68. These levels are only guidelines. Tomorrow, Bitcoin can easily breakout or breakdown of these, hence, please trade with caution. I recommend staying on the sidelines for the next couple of days, unless one is an experienced intraday trader. Ethereum has been consolidating between $390 and $480 since breaking out of the ascending triangle pattern.    For the second time, $390 acted as a strong support level on December 07. As the bears are unable to sink the digital currency below $390, the bulls will attempt a breakout above $480. If successful, Ethereum is likely to quickly rally towards its pattern target of $652. On the other hand, if the bears sink the cryptocurrency below the support levels of $390, the bullish view and the higher pattern targets will be invalidated. Therefore, traders can keep their stop-loss marginally lower than $390. Yesterday, Bitcoin Cash dipped below our stop loss levels; so I shall consider the position as closed. However, the dip proved to be temporary, as prices again recovered quickly.  Bitcoin Cash has become range-bound between $1129.33 on the lower end and $1758.4 on the upper end. At the current levels, it is right in the middle of the range. I suggest buying on a breakout above $1760 levels or waiting for a dip towards $1129 for initiating any fresh positions. A breakout of the range has a pattern target of $2387, above which, a retest of the high is possible. On the other hand, if the digital currency breaks down to $1129, it has support at $1000 from the 50-day SMA. If this level breaks, a fall to $854 is also possible. The fall on December 06, broke below my stop loss of $0.218. However, Ripple found support at $0.20 levels and has bounced back sharply once again.  The virtual currency has formed a large ascending triangle pattern, which will complete on a breakout of $0.3.  On the downside, the trendline of the triangle is likely to act as a strong support. Ripple will become negative only on a fall below the trendline. Until then, a rally to $0.30 is on the cards. Due to the volatility inside the triangle, the best place to buy is near the trendline support or on a breakout above the overhead resistance. Litecoin fell towards the 20-day EMA, just as I expected. From there, strong buying propelled it to new highs.  The breakout of the channel had a pattern target of $154, and Litecoin reached a high of $157.36. As the price has reached its target objective, partial profits can be booked at the current levels. I anticipate a couple of days of consolidation after which the bulls will attempt to resume the uptrend once again.  The next target on the upside can be extrapolated only after the consolidation. The virtual currency is likely to find support at $140.22 and $129.612, which are 23.6% and 38.2% Fibonacci retracement levels of the current rally. Dash fell to the 20-day EMA yesterday, where buying emerged, pushing it back into the ascending channel.  I expect the digital currency to retest the highs at $815 once again. If the bulls manage to breakout of this overhead resistance, we might see a rally towards the resistance line of the ascending channel. Dash will become negative only on a fall below $640 levels. The market data is provided by the HitBTC exchange.  Follow us on Facebook  Follow us on Facebook Hide Comments  For updates and exclusive offers, enter your e-mail below.  Cointelegraph covers Fintech, Blockchain and Bitcoin bringing you the latest news and analyses on the future of money.   Thank you for contacting us! We will reply to you as soon as possible. Thank you for your interest in our franchise program. We are considering your request and will contact you in due course. If you have any further queries, please contact: franchise@cointelegraph.com",https://cointelegraph.com/news/price-analysis-december-09-bitcoin-ethereum-bitcoin-cash-ripple-litecoin-dash
2017-12-09 20:18:00,Ripple,cointelegraph,"Price Analysis, December 09: Bitcoin, Ethereum, Bitcoin Cash, Ripple, Litecoin, Dash","Receive all Cointelegraph news immediately in Telegram. Cointelegraph   Advertise   You don’t want to miss out this price analytics. Price Analysis The views and opinions expressed here are solely those of authors/contributors and do not necessarily reflect the views of Cointelegraph.com. Every investment and trading move is risky, you should conduct your own research when making a decision. Bitcoin is on the cusp of mass adoption, with futures trading starting on the CBOE from 6 p.m. ET on Sunday and on the CME from December 18. After the buying frenzy of the past few days, the question in everybody's mind is whether the trading in futures will boost prices higher or will the short sellers use the opportunity to sink prices lower. This is an unprecedented event; hence, it is very difficult to forecast the final outcome. Nevertheless, the volatility is likely to remain high in the first few hours and days of futures trading, as both the bulls and the bears slug it out at the CBOE. While the intraday traders can use the opportunity to profit from the volatility, it will be a difficult time for the investors. Additionally, how will the trading in Bitcoin affect the altcoins? Will it be bullish or will bitcoin garner all the attention? We will get the answers next week. Until I get a clear picture, I will not recommend any trading positions at the moment. The momentum in Bitcoin pierced through the critical Fibonacci resistance levels. It hit a high of $17237.44, well above the levels where I had advocated booking profits in my previous analysis.     After three large range days, the digital currency is forming an inside day candlestick pattern. I believe that the first few hours of futures trading are likely to be very volatile. It is difficult to predict, which way will the prices move. We can only keep certain levels in mind and work with them once the volatility subsides. On the downside, support is at $12734.97 and $11344.15, which are 38.2% and 50% Fibonacci retracement levels of the rally from $5450.86 to $17237.44. On the upside, if price breaks out to new highs, its next level of resistance is the Fibonacci extension level of $18281.68. These levels are only guidelines. Tomorrow, Bitcoin can easily breakout or breakdown of these, hence, please trade with caution. I recommend staying on the sidelines for the next couple of days, unless one is an experienced intraday trader. Ethereum has been consolidating between $390 and $480 since breaking out of the ascending triangle pattern.    For the second time, $390 acted as a strong support level on December 07. As the bears are unable to sink the digital currency below $390, the bulls will attempt a breakout above $480. If successful, Ethereum is likely to quickly rally towards its pattern target of $652. On the other hand, if the bears sink the cryptocurrency below the support levels of $390, the bullish view and the higher pattern targets will be invalidated. Therefore, traders can keep their stop-loss marginally lower than $390. Yesterday, Bitcoin Cash dipped below our stop loss levels; so I shall consider the position as closed. However, the dip proved to be temporary, as prices again recovered quickly.  Bitcoin Cash has become range-bound between $1129.33 on the lower end and $1758.4 on the upper end. At the current levels, it is right in the middle of the range. I suggest buying on a breakout above $1760 levels or waiting for a dip towards $1129 for initiating any fresh positions. A breakout of the range has a pattern target of $2387, above which, a retest of the high is possible. On the other hand, if the digital currency breaks down to $1129, it has support at $1000 from the 50-day SMA. If this level breaks, a fall to $854 is also possible. The fall on December 06, broke below my stop loss of $0.218. However, Ripple found support at $0.20 levels and has bounced back sharply once again.  The virtual currency has formed a large ascending triangle pattern, which will complete on a breakout of $0.3.  On the downside, the trendline of the triangle is likely to act as a strong support. Ripple will become negative only on a fall below the trendline. Until then, a rally to $0.30 is on the cards. Due to the volatility inside the triangle, the best place to buy is near the trendline support or on a breakout above the overhead resistance. Litecoin fell towards the 20-day EMA, just as I expected. From there, strong buying propelled it to new highs.  The breakout of the channel had a pattern target of $154, and Litecoin reached a high of $157.36. As the price has reached its target objective, partial profits can be booked at the current levels. I anticipate a couple of days of consolidation after which the bulls will attempt to resume the uptrend once again.  The next target on the upside can be extrapolated only after the consolidation. The virtual currency is likely to find support at $140.22 and $129.612, which are 23.6% and 38.2% Fibonacci retracement levels of the current rally. Dash fell to the 20-day EMA yesterday, where buying emerged, pushing it back into the ascending channel.  I expect the digital currency to retest the highs at $815 once again. If the bulls manage to breakout of this overhead resistance, we might see a rally towards the resistance line of the ascending channel. Dash will become negative only on a fall below $640 levels. The market data is provided by the HitBTC exchange.  Follow us on Facebook  Follow us on Facebook Hide Comments  For updates and exclusive offers, enter your e-mail below.  Cointelegraph covers Fintech, Blockchain and Bitcoin bringing you the latest news and analyses on the future of money.   Thank you for contacting us! We will reply to you as soon as possible. Thank you for your interest in our franchise program. We are considering your request and will contact you in due course. If you have any further queries, please contact: franchise@cointelegraph.com",https://cointelegraph.com/news/price-analysis-december-09-bitcoin-ethereum-bitcoin-cash-ripple-litecoin-dash
2017-12-15 10:19:00,Ripple,cointelegraph,"Ethereum, Ripple and Litecoin Boom As Bloomberg Adds Them To Terminal","Receive all Cointelegraph news immediately in Telegram. Cointelegraph   Advertise   Bloomberg adds the three altcoins to its terminal just as they are experiencing explosive growth. Ripple (XRP) has hit huge new all-time highs as the altcoin joins Ethereum (ETH) and Litecoin (LTC) in debuting on Bloomberg Terminals. News that Bloomberg had added the three cryptocurrency assets to its benchmark price tracker sent XRP soaring to almost $0.90 per coin - an increase of almost 300 percent in just three days. The publication’s journalist Lily Katz confirmed the additions Thursday. Come one, come all -- @TheTerminal has officially added ether, litecoin and ripple pricing pic.twitter.com/RDGchH5QEP This week has seen altcoins broadly return to form after several weeks of intense investor attention on Bitcoin, which also hit new all-time highs Friday of almost $17,900. ETH and LTC have surpassed short-term expectations in recent days, rising to above $750 and $300 respectively. In addition, Dash almost claimed the $1,000 price tag before correcting down towards $900, all assets following in the steps of Monero, which suddenly rallied to three times its price over the past two weeks. Markets are likely set to see further flux into and out of Bitcoin over the coming weeks as a host of hard forks make their debut, investors keen to access duplicate balances tradeable on exchanges. Super Bitcoin held its network snapshot this week, while Bitcoin Platinum, Bitcoin God and Bitcoin Cash Plus are also due to do so before the end of the year. Bitcoin Silver and Bitcoin Uranium are also planned, while Bitcoin Diamond futures are already being tracked on Coinmarketcap.  Follow us on Facebook  Follow us on Facebook Hide Comments  For updates and exclusive offers, enter your e-mail below.  Cointelegraph covers Fintech, Blockchain and Bitcoin bringing you the latest news and analyses on the future of money.   Thank you for contacting us! We will reply to you as soon as possible. Thank you for your interest in our franchise program. We are considering your request and will contact you in due course. If you have any further queries, please contact: franchise@cointelegraph.com",https://cointelegraph.com/news/ethereum-ripple-and-litecoin-boom-as-bloomberg-adds-them-to-terminal
2017-12-16 19:51:00,Ripple,cointelegraph,"Bitcoin, Ethereum, Bitcoin Cash, Ripple, IOTA, Litecoin, Dash: Price Analysis, December 16","Receive all Cointelegraph news immediately in Telegram. Cointelegraph   Advertise   Again Bitcoin is breaking records, Ethereum has dropped pretty low, but managed to recover. See what else. Price Analysis The views and opinions expressed here are solely those of authors/contributors and do not necessarily reflect the views of Cointelegraph.com. Every investment and trading move involves risk, you should conduct your own research when making a decision. Bitcoin futures trading volume in its first week was only a fraction of cash Bitcoin transactions. Futures volume has been abysmal at $60 mln per day, compared to the cash transactions of $8.5 bln each day.   However, come Sunday, the CME will start Bitcoin futures trading. Additionally, large brokerage houses are likely to follow suit and allow their clients to trade in Bitcoin futures. If this happens, we are likely to see the futures volume pick up. Will the participation of more traditional investors boost the market capitalization of Bitcoin and the cryptocurrency universe? Max Keiser who hosts the Keiser Report on RT certainly thinks so. He believes that futures trading will help the cryptocurrency market capitalization reach  $1 tln and higher. Notwithstanding, these are predictions for the long-term. Let’s look at the charts to find out the likely movement of cryptocurrencies in the short-term. Bitcoin broke out to new lifetime highs yesterday after a three-day consolidation. This is a bullish development.  The breakout opens up a pattern target of $24,291.58 for Bitcoin. However, this target is unlikely to be achieved in a hurry. The cryptocurrency is likely to face some resistance at  $20,000. Our bullish view will be invalidated if the bears overpower the bulls and sink the digital currency below $15,200 levels. With the start of futures trading on CME, we can expect an increase in volatility. Therefore, traders should reduce their position size for the next few days until volatility subsides. Intraday traders, however, will get ample opportunity to place bets on both sides of the trade.   Ethereum fell to a low of $610.03 yesterday, close to our expectation of a fall to the 50 percent Fibonacci retracement level.  The long tail yesterday shows that bulls are eager to buy the dips. However, failure to break out to new lifetime highs shows that they are booking profits at higher levels. As a result, Ethereum is likely to remain range-bound until the price breaches $610.03 on the downside or $780 on the upside. However, if the bulls’ breakout to new highs and sustain it, the next target on the cryptocurrency is $995.99. These targets are only assumptions based on technical analysis. Many times these targets are not met and we change our view accordingly. Therefore, traders should always trail their stops higher to safeguard their profits and not be fixated only on the target. We are in the money on our trade in Bitcoin Cash. So, does the chart pattern suggest further upside or has the rally run its course?    The cryptocurrency broke out and closed above the range on Dec. 14. This should have ideally propelled Bitcoin Cash towards its target objective of $2,387. However, it could not cross $2,100 levels. Subsequently, bears attempted to push the cryptocurrency back into the range. However, the bulls have managed to close above $1,758 levels for the past three days, which is a positive sign. The next up move will start once the price breaks out of $1,950 levels. Hence, please hold the positions with the stop-loss at breakeven. The bullish view will be negated once the price sinks below $1,520 levels. In our previous analysis we had recommended traders to book partial profits because we expected a strong resistance at $0.86 levels. On Dec. 14, Ripple topped out at $0.88268 levels.  On Dec. 15 the cryptocurrency pulled back to the 38.2 percent Fibonacci retracement of the rally. Nonetheless, the lower levels continue to attract buying from the bulls. We expect the bulls to attempt to break out of the lifetime highs again. If successful, Ripple will make a dash towards $1 levels and higher. However, if bulls fail to breakout and sustain above the lifetime highs, we are likely to witness a few days of range-bound trading between $0.61 on the lower end and $0.88268 on the upper end.   We anticipated a fall towards the 20-day EMA and that is what happened. On Dec. 14 and 15 IOTA fell close to the 50 percent Fibonacci retracement levels of the rally.  The bulls purchased the fall to the critical support levels. However, the cryptocurrency continues to face resistance on every rise. The chart pattern will become bullish in the short-term only on a breakout and close above the downtrend line, above which a rally to the lifetime highs is likely. Nevertheless, if price fails to breakout of the downtrend line, it will lead to the formation of a descending triangle pattern, which is a bearish development. The cryptocurrency will become negative on a breakdown and close below the critical support level of $3.032. We had forecast a period of correction/consolidation in our previous analysis and that is what we got.  As expected, the bulls purchased the dips to $243.86 levels, which is the 38.2 percent Fibonacci retracement of the rally. However, we believe that the levels between $300 and $342.237 will continue to act as a stiff resistance. We believe that after the sharp rally, Litecoin will be range-bound for the next few days. Notwithstanding, if the bulls’ breakout to new lifetime highs, then the next target objective on the upside is a rally to $497.53. Though Dash has not run away to its target of $1,199.01, it’s sustaining above $815 levels, which is a positive indication. Bears attempted to push the cryptocurrency back below $815 levels on Dec. 15, however, they were unsuccessful.  This increases the possibility of an upside breakout of $979 and a rally towards the target objective. The bullish view will be invalidated if the digital currency falls and sustains below $815. Traders who had purchased long positions on our earlier analysis should raise their stops to $780 on the remaining 50 percent positions. The market data is provided by the HitBTC exchange.  Follow us on Facebook  Follow us on Facebook Hide Comments  For updates and exclusive offers, enter your e-mail below.  Cointelegraph covers Fintech, Blockchain and Bitcoin bringing you the latest news and analyses on the future of money.   Thank you for contacting us! We will reply to you as soon as possible. Thank you for your interest in our franchise program. We are considering your request and will contact you in due course. If you have any further queries, please contact: franchise@cointelegraph.com",https://cointelegraph.com/news/bitcoin-ethereum-bitcoin-cash-ripple-iota-litecoin-dash-price-analysis-december-16
