Date,Coin,website,Headline,Text,Link
2017-10-11 16:40:00,Ripple,cointelegraph,"Bitcoin, Ethereum, Bitcoin Cash, Ripple, Litecoin: Price Analysis, October 11","Receive all Cointelegraph news immediately in Telegram. Cointelegraph   Advertise   Latest price review and trading suggestions on most popular cryptocurrencies. Price Analysis The views and opinions expressed here are solely those of authors/contributors and do not necessarily reflect the views of Cointelegraph.com. Every investment and trading move involves risk, you should conduct your own research when making a decision. * BTC/USD, ETH/USD and LTC/USD market data is provided by the HitBTC exchange. The beauty of trading is that when prices are correcting, there’s news of doom all around. All the bears come out of hibernation, forecasting a crash, and the bulls hide in a corner. The exact opposite happens when price reaches lifetime highs. This creates fear in the minds of the traders who miss buying at the lows and selling at the highs. Therefore, we focus on the price action to forecast the next possible move. Now that Bitcoin is close to its highs, what should we do? Traders who went long at lower levels on our recommendations have been booking profits near resistances. We are left with about 30 - 35 percent of our original position, which we had planned to book at $5000. Should we book out close to the highs, or wait for higher levels?  Yesterday, the cryptocurrency reached a high of $4932.9, very close to our target levels. However, selling at the highs has pushed Bitcoin back below the $4800 levels. As the digital currency is trading above $4680, chances are that it will again attempt to breakout to new highs soon. If the bulls are successful in sustaining above $5000, the cryptocurrency is likely to gain momentum, and it will indicate the start of a new uptrend. Therefore, we recommend holding the existing position with a stop loss of $4500. We don’t want to keep a deeper stop loss because, usually, when bulls fail to breakout of a strong overhead resistance, bears sell aggressively, sending prices lower. So, if the bulls fail to breakout and sustain above $5000, we can expect the bears to push the cryptocurrency down to at least $4184.6 levels, which is the 38.2 percent Fibonacci retracement level of the pullback from $2974 to $4932.9. Traders who went long at $317 with a stop loss of $278 on our recommendation had to face a loss. In hindsight, it looks like we purchased at the highs of the range and sold off at the lows of the range.  However, we had intended to buy on a breakout of the range. As the range had been building for a few days, we believed that it would have enough force to carry it higher. Therefore, we didn’t recommend waiting for a close above the range to initiate long positions. Similarly, on the downside, we’d expected that once the cryptocurrency broke out, it wouldn’t return to the lows of the range. Nevertheless, Ethereum proved us wrong on both fronts. So, how can we trade Ethereum now? Currently, the cryptocurrency is trading close to the center of the range. We don’t want to enter a long trade unless Ethereum breaks out and closes above $317. We may miss out on a few points, but at least we won’t be caught in these fake breakouts and breakdowns. We shall keep an initial stop loss of $278 only, because, we don’t expect prices to fall back below the range, once it breaks out and closes above it. We have been correct in avoiding Bitcoin Cash on the long side. On Oct. 9, the cryptocurrency broke below the critical support of $300, forming a low of $280.1. So, is this low level a good time to buy?  Bitcoin Cash is devoid of buyers. Though the digital currency has recovered above $300 levels, it continues to make lower lows and lower highs, which suggests that a bottom is still not in place. Until the digital currency remains below $385 and the 20-day exponential moving average (EMA), it will continue to face selling pressure on rallies. On the lower end, Bitcoin Cash can fall to $285 and thereafter to $200 levels. On the upside, any rally towards $385 levels is likely to face stiff resistance. We don’t find any buy setup on the cryptocurrency; therefore, we don’t have any recommendation on it. The sharp fall on Oct. 9 hit our stop loss at $0.23500 on the 35 percent of our remaining position. This is the reason we always recommend booking partial profits as the price moves higher, especially when the cryptocurrency is not in a strong uptrend. Presently, we don’t have any positions in Ripple.  It has recovered after falling below the downtrend line on Oct. 9. However, bulls will face stiff resistance at $0.28000 and $0.30000. On the downside, the cryptocurrency has support at $0.23000. Considering the levels, we don’t find a trade set up with a good risk to reward ratio. Therefore, we shall wait and watch until we get a good entry point. There is nothing much happening in Litecoin. The cryptocurrency is stuck inside the range, due to which traders seem to have abandoned it at the moment.  Litecoin has a history of forming ranges and then breaking out of them. We’re currently in a similar situation. Whenever the price breaks out of the upper end of the range at $58, chances are that it will again take off. Until then, the cryptocurrency is likely to trade between $44 and $58. We shall not take a trade inside this range.  Follow us on Facebook  Follow us on Facebook Hide Comments  For updates and exclusive offers, enter your e-mail below.  Cointelegraph covers Fintech, Blockchain and Bitcoin bringing you the latest news and analyses on the future of money.   Thank you for contacting us! We will reply to you as soon as possible. Thank you for your interest in our franchise program. We are considering your request and will contact you in due course. If you have any further queries, please contact: franchise@cointelegraph.com",https://cointelegraph.com/news/bitcoin-ethereum-bitcoin-cash-ripple-litecoin-price-analysis-october-11
2017-10-13 14:05:00,Ripple,cointelegraph,"Bitcoin, Ethereum, Bitcoin Cash, Ripple, Litecoin: Price Analysis, October 13","Receive all Cointelegraph news immediately in Telegram. Cointelegraph   Advertise   Bitcoin is breaking new highs. Find out what’s going with other cryptocurrencies and what trading moves to consider. Price Analysis The views and opinions expressed here are solely those of authors/contributors and do not necessarily reflect the views of Cointelegraph.com. Every investment and trading move involves risk, you should conduct your own research when making a decision. * BTC/USD, ETH/USD and LTC/USD market data is provided by the HitBTC exchange. The traders continue to pile on Bitcoin, while altcoins languish. Bitcoin’s market dominance has crossed 55 percent, which shows that it’s now becoming a crowded trade. At times, it’s a good strategy to take the contrarian bet against the crowd. So, is it a good time to book profits on our Bitcoin positions and buy a few altcoins, or does Bitcoin have legs to further extend the rally? Let’s see. Leading up to its first fork in August, Bitcoin prices were in a corrective phase till about 15 days prior to the D-day. This time, however, prices have been in a consistent uptrend since bottoming out on Sept. 15.  After Bitcoin Cash was created, Bitcoin broke out and closed at new highs on Aug. 5, which started a strong uptrend that carried the cryptocurrency roughly 71 percent higher in just under a month. Will the same scenario be repeated this time? Looks unlikely. Last time, there were a number of folks who had sold off prior to the fork and were sitting on the sidelines. When Bitcoin did not crash, as a few had expected, all this money jumped back in, boosting prices within a short span of time. However, this time, people seem to be buying prior to the fork, so that they can benefit from the new coins. This is looking like a crowded trade. Can this get more crowded? Certainly. However, as we are sitting on decent profits on about 35 percent of our original position, we recommend booking out completely at current levels. Can prices rise further from here and make us look like fools? They certainly can. However, it can equally fall back below $5000 once this buying frenzy ends. It’s always better to pocket good gains after a buying stampede and wait for the next opportunity. We may have to buy at higher levels, but, that’s how it is. It’s very difficult to buy at the bottom and sell at the top. Nevertheless, for traders who want to hold on to their long positions, the next target on the cryptocurrency is $6197. Bitcoin has support at the $5000 levels, which had been a strong resistance until now.  The cryptocurrency will not become negative until it breaks below $4800 levels. Ethereum continues to remain volatile, but is on the verge of breaking out of the range. In our last trade, we were caught on the wrong side, as the breakout was faded by the bears. So, how should we approach it now?  Even today, the cryptocurrency has formed a very large range with an intraday high of $352.52 and an intraday low of $274.67. Though prices have broken out of the range, which makes us bullish, the stop loss for the trade is very deep. After four previous false breakouts, we would rather wait for Ethereum to end the day above the range, signaling the start of a new uptrend. On a close above the range, our first target is $354, above which, a move to $400 is also possible. However, we are not recommending a trade on Ethereum until we get a closing above $317. Bitcoin Cash is not showing any interest either from bulls or bears. It continues to slide gradually, struggling to hold the $300 levels.  The cryptocurrency is attempting to find support at the $282 levels. However, the pullback from the support is not very convincing. If Bitcoin Cash breaks below the immediate support zone of $265 to $282, it is likely to retest the lows. On the other hand, any pullback is likely to face resistance at the downtrend line and the 20-day exponential moving average (EMA). There are no bullish setups, therefore, we are not recommending any trade on it. As is the case with most altcoins, Ripple is also facing selling pressure. As a result, it has fallen back into the descending triangle.  The cryptocurrency is attempting to hold the 20-day EMA. It if bounces off this support, it is likely to rally towards the recent swing high of $0.28000, above which a move to $0.30000 is also possible. However, if the digital currency breaks down of the 20-day EMA, it has some support from the small uptrend line and the 50-day simple moving average. Aggressive traders can go long on Ripple if it breaks out of the downtrend line of the descending triangle, and the smaller downtrend line drawn from the recent highs of $0.28000. This level is likely to be around $0.26000. The stop loss for this trade can be kept at $0.23000. We don’t want to hold the cryptocurrency if it again falls back into the triangle. The target objective on the upside is $0.30000. Litecoin is one of the few altcoins that showed strong buying support yesterday. Though we did not have a buy recommendation on Litecoin, we did mention that it will become positive once it breaks out of the range.  Yesterday, the cryptocurrency rose sharply, breaking out of the overhead resistance of $57.72. However, today, the digital currency is facing a tough battle between the bulls and the bears at the $58 mark. If traders entered long positions at $58, please hold with a stop loss of $48. The first target objective is $71. Others who have not yet entered long positions can wait and enter above $61, which will signal a victory for the bulls. The stop loss, in this case, can be kept at $50 and the profit objective remains $71.  Follow us on Facebook  Follow us on Facebook Hide Comments  For updates and exclusive offers, enter your e-mail below.  Cointelegraph covers Fintech, Blockchain and Bitcoin bringing you the latest news and analyses on the future of money.   Thank you for contacting us! We will reply to you as soon as possible. Thank you for your interest in our franchise program. We are considering your request and will contact you in due course. If you have any further queries, please contact: franchise@cointelegraph.com",https://cointelegraph.com/news/bitcoin-ethereum-bitcoin-cash-ripple-litecoin-price-analysis-october-13
2017-10-14 11:50:00,Ripple,cointelegraph,Delaware Judge Throws Out Case Against Blockchain-Based Payment Network Ripple,"Receive all Cointelegraph news immediately in Telegram. Cointelegraph   Advertise   Ripple claims victory over R3 in XRP lawsuit case. Regulations In an apparent victory for the Blockchain-based payment network Ripple, a Delaware judge ruled in their favor regarding the recent lawsuit over R3 consortium’s wish to force the company to make good on a contract to buy a huge volume of XRP. The news broke via Ripple’s Twitter account: Breaking news! https://t.co/tK0tHPjQ6Z R3, the ‘Blockchain-inspired’ startup servicing banks and financial institutions, maintains that Ripple Labs has violated a prior purchase agreement for XRP tokens between the two companies. Brad Garlinghouse, Ripple’s CEO, started the Twitter feud, indicating that the judge in the Delaware lawsuit had ruled to ‘throw out’ the case. However, after further information came to light, the judge had issued a verbal ruling regarding Delaware’s jurisdiction over the matter. The lawsuit will proceed, however, in California and New York. The case, according to others, will continue in California and New York. R3 is suing Ripple for specific performance of an option agreement in which Ripple agreed to sell up to five bln XRPs for a price of $.0085. Ripple has countersued, claiming that R3 reneged on a number of contractual promises, and is simply acting in a spirit of opportunism, after the cryptocurrency soared more than 30 times over.  Follow us on Facebook  Follow us on Facebook Hide Comments  For updates and exclusive offers, enter your e-mail below.  Cointelegraph covers Fintech, Blockchain and Bitcoin bringing you the latest news and analyses on the future of money.   Thank you for contacting us! We will reply to you as soon as possible. Thank you for your interest in our franchise program. We are considering your request and will contact you in due course. If you have any further queries, please contact: franchise@cointelegraph.com",https://cointelegraph.com/news/delaware-judge-throws-out-case-against-blockchain-based-payment-network-ripple
2017-10-16 19:25:00,Ripple,cointelegraph,"Bitcoin, Ethereum, Bitcoin Cash, Ripple, Litecoin: Price Analysis, October 16","Receive all Cointelegraph news immediately in Telegram. Cointelegraph   Advertise   Latest price review and trading suggestions on most popular cryptocurrencies. Price Analysis The views and opinions expressed here are solely those of authors/contributors and do not necessarily reflect the views of Cointelegraph.com. Every investment and trading move involves risk, you should conduct your own research when making a decision. * BTC/USD, ETH/USD and LTC/USD market data is provided by the HitBTC exchange. While on one side, the traditional money managers and investment bankers continue to voice their opposition to Bitcoin, the State bank of Mauritius (SMB) has approved the use of Blockchain assets as collateral for loans. Russia, on the other hand, is moving ahead with its own ‘CryptoRuble’, according to local news sources. Will this cryptocurrency succeed? Only time will tell. However, early investors in cryptocurrencies continue to report staggering returns. One such person to report greater than 50,000% returns was Wikileaks founder, Julian Assange. While a similar increase from the current levels is unlikely, we can still ride the trends and earn triple-digit returns in a calendar year. We have no existing positions in Bitcoin. We recommended selling our remaining positions in the cryptocurrency on October 13. Our selling price was $5650, a tad below where Bitcoin is trading now. Right now the digital currency is trading near a significant resistance from the ascending channel line. It has been unable to breakout of this resistance on four previous occasions. This is not to say that it can’t breakout. It certainly can. However, this is a good place to book profits and wait for the next opportunity. If the price breaks out of the channel, it is likely to become very positive and rally to $6400 quickly. We shall try to enter this trade if we get a good entry and stop loss point. However, if the bulls are unable to break out of the overhead resistance, the cryptocurrency will either be range bound between $5400 and $5800 or correct to the breakout levels of $5000. At the current levels, we don’t find a trade setup offering us a good risk to reward ratio. Therefore, we are currently not recommending any trade on the cryptocurrency. Ethereum remained volatile ahead of its fork. Now, that the event is behind us, we expect the volatility to reduce. We don’t have any existing position in Ethereum, as we were waiting for a breakout and close above the range. On October 13, though the cryptocurrency broke out of the range, it closed way higher for us to enter any position. Also, due to the huge intraday swings, we have stayed away from it. Currently, it is facing selling above the $350 mark. Though it has broken above this level in intraday trading, it has not been able to close above it. If we don’t see a close above $350 within the next two days, the bears are likely to sink the cryptocurrency back towards $316 levels. On the other hand, if the bulls manage a close above $350, Ethereum can rally to $390 levels. However, as the cryptocurrency lacks momentum at the current levels, we are not suggesting any trade on it. Bitcoin Cash has been trading in a very small range for the past few days. Though the fall has been arrested, it is yet to show any buying interest. The bulls are currently only trying to defend the $282 levels. If this level breaks, a fall towards the lows is likely. However, for the digital currency to become positive again, it has to first break out of the downtrend line and form a series of higher highs and higher lows. Until then, every pullback towards the downtrend line and the 20-day exponential moving average (EMA) is likely to face selling pressure. After a few days of low volatility, we expect volatility to increase over the next few days. However, it is difficult to forecast which way Bitcoin Cash will move.  Therefore, presently, we think it’s better not to trade it. We had recommended a long trade on Ripple in our previous analysis for the aggressive traders. Our profit objective was $0.3. What should we do now?  Ripple is close to our first target objective, where it is likely to face some resistance. Therefore, we suggest traders to book 30% profits on the existing positions at the current levels of $0.29 and hold the rest with a stop loss of $0.26. This way, we will pocket a small profit and our remaining position becomes risk-free. If the digital currency breaks out of $0.3 levels, it can rally to $0.325 and $0.34 levels. Therefore, we want to hold the remaining position. However, once Ripple moves higher, please trail the stops accordingly. We have long positions in Litecoin at $58 and $61. Our profit objective was $71 and yesterday, the cryptocurrency reached a high of $70.466. Though we would have booked at least 30% profits close to $70, we had not recommended it. The cryptocurrency is currently facing selling at the $70 levels. Today, it dipped back to $62 levels, where buying emerged. Currently, it is attempting to climb back again. However, traders who are long at $58 and $61 should increase their stop loss to breakeven. We don’t want to see a loss on our positions after being so close to the target. If the digital currency doesn’t breakout of $67, it will again fall to $58 levels. However, if Litecoin rallies back to $70, please sell 30% positions and hold the rest with the stops at breakeven. We shall raise the stop loss once Litecoin breaks out of $71.  Follow us on Facebook  Follow us on Facebook Hide Comments  For updates and exclusive offers, enter your e-mail below.  Cointelegraph covers Fintech, Blockchain and Bitcoin bringing you the latest news and analyses on the future of money.   Thank you for contacting us! We will reply to you as soon as possible. Thank you for your interest in our franchise program. We are considering your request and will contact you in due course. If you have any further queries, please contact: franchise@cointelegraph.com",https://cointelegraph.com/news/bitcoin-ethereum-bitcoin-cash-ripple-litecoin-price-analysis-october-16
2017-10-19 15:25:00,Ripple,cointelegraph,Japanese Ripple Crypto Exchange Takes Hit as Founder Arrested for Scam,"Receive all Cointelegraph news immediately in Telegram. Cointelegraph   Advertise   A manager at a Ripple exchange has swindled $12,470 Scam Alert Ripple cryptocurrency exchange in Hamamatsu, Shizuoka Prefecture, was raided by police as they closed in on the manager of the exchange who was looking to make off with ¥1.4 mln ($12,470) of one of their customer’s money. Yuki Takenaka, the 31-year-old founder and head of a company operating the Ripple exchange, collected his stolen funds even though his firm was in a state of collapse and unable to make refunds at that time. It is the first arrest in Japan made in connection with a bourse of the Ripple virtual currency, as Takenaka has admitted to most of the charges, according to the police. Having set up the exchange in May 2014, Takenaka quickly fell out of favour as users were unable to withdraw cash or contact him. In a strange business model, his company collected money from its users in exchange for IOUs, or written acknowledgements of debt, needed for Ripple online transactions. Users could exchange the notes with Ripple or convert them into cash. But it has also emerged that Takenaka allegedly swindled more than ¥10 mln out of a dozen users by false advertising that his company charges no commission. Additionally, there are investigations into the supposed issuing of fictitious IOUs which amount to approximately ¥120 mln. Ripple, as a cryptocurrency, is slightly different to others, as they are looking to become a legitimate digital currency for use within the banking sector; and they pride themselves on being centralised. The Ripple currency is usually used for international payments and cannot be used for merchandise purchases. Ripple is looking to break into the banking market with its tough regulations, and while this incident has nothing to do with Ripple as a currency, it shows yet again that the crypto market is still a wild west for many and there is very little protection for individuals.  Follow us on Facebook  Follow us on Facebook Hide Comments  For updates and exclusive offers, enter your e-mail below.  Cointelegraph covers Fintech, Blockchain and Bitcoin bringing you the latest news and analyses on the future of money.   Thank you for contacting us! We will reply to you as soon as possible. Thank you for your interest in our franchise program. We are considering your request and will contact you in due course. If you have any further queries, please contact: franchise@cointelegraph.com",https://cointelegraph.com/news/japanese-ripple-crypto-exchange-takes-hit-as-founder-arrested-for-scam
